{
  "schema_version": "1.1.0",
  "trialfolio_version": "0.3.0",
  "attempt_id": "de2e8c99-c930-4e1f-a0ce-21c4558dc69c",
  "case_id": "case-e29404ddebf86363",
  "plan_hash": "sha256:ed9d5bb8d4e1b232b1768c2f7da08c0c328dd71a1d1f708d0205f1d96055979b",
  "session": 1,
  "sequence": 1,
  "authenticated_by": "de2e8c99-c930-4e1f-a0ce-21c4558dc69c",
  "repeat_of": null,
  "started_at": "2026-10-03T14:00:02Z",
  "provider_wrapper": {
    "p123api": "3.1.0"
  },
  "transport": {
    "requests": "2.34.2",
    "urllib3": "2.8.0"
  },
  "ended_at": "2026-10-03T14:00:03Z",
  "outcome": "succeeded",
  "error": null,
  "exchanges": [
    {
      "request": "POST /auth",
      "result": "response",
      "status": 200,
      "note": null
    },
    {
      "request": "POST /screen/backtest",
      "result": "response",
      "status": 200,
      "note": null
    }
  ],
  "possibly_charged": true,
  "request": {
    "path": "cases/case-e29404ddebf86363/attempts/de2e8c99-c930-4e1f-a0ce-21c4558dc69c/request.json",
    "artifact_id": "sha256:84d9553e5d05e7be96f6191ffdd68d37a9bf5e80ac2ed94a217c6db2e4cd9fbd"
  },
  "response": {
    "path": "cases/case-e29404ddebf86363/attempts/de2e8c99-c930-4e1f-a0ce-21c4558dc69c/response.json",
    "artifact_id": "sha256:ee269d536bf73c7c1846bd24240f4b1d460e7867a7c935c486c656228077f4b8",
    "form": "decoded"
  },
  "provider_metadata": {
    "cost": null,
    "quota_remaining": null
  }
}
