{
  "schema_version": "1.1.0",
  "trialfolio_version": "0.3.0",
  "attempt_id": "7d2092bb-48ee-4f23-b2a7-5ab9532cc91a",
  "case_id": "case-0492159b4461ceff",
  "plan_hash": "sha256:ed9d5bb8d4e1b232b1768c2f7da08c0c328dd71a1d1f708d0205f1d96055979b",
  "session": 1,
  "sequence": 2,
  "authenticated_by": "de2e8c99-c930-4e1f-a0ce-21c4558dc69c",
  "repeat_of": null,
  "started_at": "2026-10-03T14:00:04Z",
  "provider_wrapper": {
    "p123api": "3.1.0"
  },
  "transport": {
    "requests": "2.34.2",
    "urllib3": "2.8.0"
  },
  "ended_at": "2026-10-03T14:00:05Z",
  "outcome": "succeeded",
  "error": null,
  "exchanges": [
    {
      "request": "POST /screen/backtest",
      "result": "response",
      "status": 200,
      "note": null
    }
  ],
  "possibly_charged": true,
  "request": {
    "path": "cases/case-0492159b4461ceff/attempts/7d2092bb-48ee-4f23-b2a7-5ab9532cc91a/request.json",
    "artifact_id": "sha256:9da945c0c9ed0508d04a544e99f49a45dcd22f047a97c5c004d42b6b461f5819"
  },
  "response": {
    "path": "cases/case-0492159b4461ceff/attempts/7d2092bb-48ee-4f23-b2a7-5ab9532cc91a/response.json",
    "artifact_id": "sha256:ee269d536bf73c7c1846bd24240f4b1d460e7867a7c935c486c656228077f4b8",
    "form": "decoded"
  },
  "provider_metadata": {
    "cost": null,
    "quota_remaining": null
  }
}
