{
  "schema_version": "1.1.0",
  "trialfolio_version": "0.3.0",
  "attempt_id": "4663a737-6385-4247-82f4-7faff621f7ab",
  "case_id": "case-edb681850dd8e058",
  "plan_hash": "sha256:25b97a3c5b3f2b7e2e98290ad507b50d3a53fc4bdbc6ea44fcd852df90c915cd",
  "session": 2,
  "sequence": 1,
  "authenticated_by": "4663a737-6385-4247-82f4-7faff621f7ab",
  "repeat_of": null,
  "started_at": "2026-10-03T14:00:09Z",
  "provider_wrapper": {
    "p123api": "3.1.0"
  },
  "transport": {
    "requests": "2.34.2",
    "urllib3": "2.8.0"
  },
  "ended_at": "2026-10-03T14:00:10Z",
  "outcome": "succeeded",
  "error": null,
  "exchanges": [
    {
      "request": "POST /auth",
      "result": "response",
      "status": 200,
      "note": null
    },
    {
      "request": "POST /screen/backtest",
      "result": "response",
      "status": 200,
      "note": null
    }
  ],
  "possibly_charged": true,
  "request": {
    "path": "cases/case-edb681850dd8e058/attempts/4663a737-6385-4247-82f4-7faff621f7ab/request.json",
    "artifact_id": "sha256:9e9bed928dad091d06c7704db67046f3c7aefb632ddb4ea728a09ce36be527ed"
  },
  "response": {
    "path": "cases/case-edb681850dd8e058/attempts/4663a737-6385-4247-82f4-7faff621f7ab/response.json",
    "artifact_id": "sha256:ee269d536bf73c7c1846bd24240f4b1d460e7867a7c935c486c656228077f4b8",
    "form": "decoded"
  },
  "provider_metadata": {
    "cost": null,
    "quota_remaining": null
  }
}
